{
  "schema": "curio.frontmatter.v1",
  "curio_id": "0197b2c4-8f3e-7cc1-a5d2-3e9f10aa4b6d",
  "title": "Article title",
  "source": "https://example.com/article",
  "feed": "https://example.com/feed.xml",
  "feed_title": "Example Blog",
  "author": "Jane Doe",
  "published": "2026-07-01T12:00:00Z",
  "saved": "2026-07-03T09:15:00.123Z",
  "tags": [
    "rust",
    "databases"
  ],
  "checksum": "sha256:9f86d081884c7d659a2feaa0c55ad015a3bf4f1b2b0b822cd15d6c15b0f00a08",
  "lang": "en",
  "word_count": 1234
}
