{
  "schema": "curio.frontmatter.v1",
  "curio_id": "0197b2c4-8f3e-7cc1-a5d2-3e9f10aa4b6d",
  "title": "Article title",
  "source": "https://example.com/article",
  "feed": null,
  "published": null,
  "saved": "2026-07-03T09:15:00.123Z",
  "tags": [],
  "checksum": "sha256:9f86d081884c7d659a2feaa0c55ad015a3bf4f1b2b0b822cd15d6c15b0f00a08"
}
